Movie_Name,Movie_Rating,Movie_cerificate,Movie_Year,Movie_Runtime,Movie_Cast,Movie_Genre,Movie_Poster,Movie_Des
Pather Panchali,8.4,U,1955,125 min,"Kanu Bannerjee, Karuna Bannerjee, Subir Banerjee, Chunibala Devi",Drama            ,"https://m.media-amazon.com/images/M/MV5BMmFkNDY5OTktNzY3Yy00OTFlLThhNjktOTRhMmZjZmIxYjAxXkEyXkFqcGdeQXVyNTgyNTA4MjM@._V1_UX67_CR0,0,67,98_AL_.jpg","Impoverished priest Harihar Ray, dreaming of a better life for himself and his family, leaves his rural Bengal village in search of work."
Sunset Blvd.,8.4,NA,1950,110 min,"William Holden, Gloria Swanson, Erich von Stroheim, Nancy Olson","Drama, Film-Noir            ","https://m.media-amazon.com/images/M/MV5BMTU0NTkyNzYwMF5BMl5BanBnXkFtZTgwMDU0NDk5MTI@._V1_UX67_CR0,0,67,98_AL_.jpg",A screenwriter develops a dangerous relationship with a faded film star determined to make a triumphant return.
The Great Dictator,8.4,NA,1940,125 min,"Charles Chaplin, Paulette Goddard, Jack Oakie, Reginald Gardiner","Comedy, Drama, War            ","https://m.media-amazon.com/images/M/MV5BMmExYWJjNTktNGUyZS00ODhmLTkxYzAtNWIzOGEyMGNiMmUwXkEyXkFqcGdeQXVyNjU0OTQ0OTY@._V1_UX67_CR0,0,67,98_AL_.jpg",Dictator Adenoid Hynkel tries to expand his empire while a poor Jewish barber tries to avoid persecution from Hynkel's regime.
1917,8.3,R,2019,119 min,"Dean-Charles Chapman, George MacKay, Daniel Mays, Colin Firth","Action, Drama, War            ","https://m.media-amazon.com/images/M/MV5BOTdmNTFjNDEtNzg0My00ZjkxLTg1ZDAtZTdkMDc2ZmFiNWQ1XkEyXkFqcGdeQXVyNTAzNzgwNTg@._V1_UX67_CR0,0,67,98_AL_.jpg","April 6th, 1917. As an infantry battalion assembles to wage war deep in enemy territory, two soldiers are assigned to race against time and deliver a message that will stop 1,600 men from walking straight into a deadly trap."
Tumbbad,8.3,A,2018,104 min,"Sohum Shah, Jyoti Malshe, Anita Date, Ronjini Chakraborty","Drama, Fantasy, Horror            ","https://m.media-amazon.com/images/M/MV5BYmQxNmU4ZjgtYzE5Mi00ZDlhLTlhOTctMzJkNjk2ZGUyZGEwXkEyXkFqcGdeQXVyMzgxMDA0Nzk@._V1_UY98_CR1,0,67,98_AL_.jpg",A mythological story about a goddess who created the entire universe. The plot revolves around the consequences when humans build a temple for her first-born.
Baahubali 2: The Conclusion,8.3,UA,2017,167 min,"Prabhas, Rana Daggubati, Anushka Shetty, Tamannaah Bhatia","Action, Drama            ","https://m.media-amazon.com/images/M/MV5BOGNlNmRkMjctNDgxMC00NzFhLWIzY2YtZDk3ZDE0NWZhZDBlXkEyXkFqcGdeQXVyODIwMDI1NjM@._V1_UX67_CR0,0,67,98_AL_.jpg","When Shiva, the son of Bahubali, learns about his heritage, he begins to look for answers. His story is juxtaposed with past events that unfolded in the Mahishmati Kingdom."
Drishyam,8.3,U,2013,160 min,"Mohanlal, Meena, Asha Sharath, Ansiba","Crime, Drama, Thriller            ","https://m.media-amazon.com/images/M/MV5BYmY3MzYwMGUtOWMxYS00OGVhLWFjNmUtYzlkNGVmY2ZkMjA3XkEyXkFqcGdeQXVyMTExNDQ2MTI@._V1_UY98_CR4,0,67,98_AL_.jpg",A man goes to extreme lengths to save his family from punishment after the family commits an accidental crime.
Bhaag Milkha Bhaag,8.3,U,2013,186 min,"Farhan Akhtar, Japtej Singh, Divya Dutta, Pawan Malhotra","Biography, Drama, Sport            ","https://m.media-amazon.com/images/M/MV5BMTY1Nzg4MjcwN15BMl5BanBnXkFtZTcwOTc1NTk1OQ@@._V1_UY98_CR0,0,67,98_AL_.jpg","The truth behind the ascension of Milkha Singh, who was scarred by of the India-Pakistan partition."
Jagten,8.3,7,2012,115 min,"Mads Mikkelsen, Thomas Bo Larsen, Annika Wedderkopp, Lasse Fogelstrøm",Drama            ,"https://m.media-amazon.com/images/M/MV5BMTg2NDg3ODg4NF5BMl5BanBnXkFtZTcwNzk3NTc3Nw@@._V1_UY98_CR1,0,67,98_AL_.jpg","A teacher lives a lonely life, all the while struggling over his son's custody. His life slowly gets better as he finds love and receives good news from his son, but his new luck is about to be brutally shattered by an innocent little lie."
Jodaeiye Nader az Simin,8.3,7,2011,123 min,"Payman Maadi, Leila Hatami, Sareh Bayat, Shahab Hosseini",Drama            ,"https://m.media-amazon.com/images/M/MV5BN2JmMjViMjMtZTM5Mi00ZGZkLTk5YzctZDg5MjFjZDE4NjNkXkEyXkFqcGdeQXVyMTMxODk2OTU@._V1_UX67_CR0,0,67,98_AL_.jpg",A married couple are faced with a difficult decision - to improve the life of their child by moving to another country or to stay in Iran and look after a deteriorating parent who has Alzheimer's disease.
Incendies,8.3,18,2010,131 min,"Lubna Azabal, Mélissa Désormeaux-Poulin, Maxim Gaudette, Mustafa Kamel","Drama, Mystery, War            ","https://m.media-amazon.com/images/M/MV5BMWE3MGYzZjktY2Q5Mi00Y2NiLWIyYWUtMmIyNzA3YmZlMGFhXkEyXkFqcGdeQXVyMTMxODk2OTU@._V1_UX67_CR0,0,67,98_AL_.jpg",Twins journey to the Middle East to discover their family history and fulfill their mother's last wishes.
Kimetsu no Yaiba: Mugen Ressha-Hen,8.3,UA,2020,117 min,"Natsuki Hanae, Akari Kitô, Yoshitsugu Matsuoka, Hiro Shimono","Animation, Action, Adventure            ","https://m.media-amazon.com/images/M/MV5BODI2NjdlYWItMTE1ZC00YzI2LTlhZGQtNzE3NzA4MWM0ODYzXkEyXkFqcGdeQXVyNjU1OTg4OTM@._V1_UX67_CR0,0,67,98_AL_.jpg","After his family was brutally murdered and his sister turned into a demon, Tanjiro Kamado's journey as a demon slayer began. Tanjiro and his comrades embark on a new mission aboard the Mugen Train, on track to despair."
Up,8.3,U,2009,96 min,"Edward Asner, Jordan Nagai, John Ratzenberger, Christopher Plummer","Animation, Adventure, Comedy            ","https://m.media-amazon.com/images/M/MV5BMTk3NDE2NzI4NF5BMl5BanBnXkFtZTgwNzE1MzEyMTE@._V1_UX67_CR0,0,67,98_AL_.jpg","78-year-old Carl Fredricksen travels to Paradise Falls in his house equipped with balloons, inadvertently taking a young stowaway."
The Father,8.3,UA,I 2020,97 min,"Anthony Hopkins, Olivia Colman, Mark Gatiss, Olivia Williams","Drama, Mystery            ","https://m.media-amazon.com/images/M/MV5BZGJhNWRiOWQtMjI4OS00ZjcxLTgwMTAtMzQ2ODkxY2JkOTVlXkEyXkFqcGdeQXVyMTkxNjUyNQ@@._V1_UX67_CR0,0,67,98_AL_.jpg","A man refuses all assistance from his daughter as he ages. As he tries to make sense of his changing circumstances, he begins to doubt his loved ones, his own mind and even the fabric of his reality."
Babam ve Oglum,8.3,NA,2005,112 min,"Eser Sariyar, Çetin Tekindor, Fikret Kuskan, Hümeyra","Drama, Family            ","https://m.media-amazon.com/images/M/MV5BNjAzMzEwYzctNjc1MC00Nzg5LWFmMGItMTgzYmMyNTY2OTQ4XkEyXkFqcGdeQXVyNjU0OTQ0OTY@._V1_UY98_CR0,0,67,98_AL_.jpg",The family of a left-wing journalist is torn apart after the military coup of Turkey in 1980.
Toy Story 3,8.3,U,2010,103 min,"Tom Hanks, Tim Allen, Joan Cusack, Ned Beatty","Animation, Adventure, Comedy            ","https://m.media-amazon.com/images/M/MV5BMTgxOTY4Mjc0MF5BMl5BanBnXkFtZTcwNTA4MDQyMw@@._V1_UY98_CR1,0,67,98_AL_.jpg","The toys are mistakenly delivered to a day-care center instead of the attic right before Andy leaves for college, and it's up to Woody to convince the other toys that they weren't abandoned and to return home."
Batman Begins,8.3,UA,2005,140 min,"Christian Bale, Michael Caine, Ken Watanabe, Liam Neeson","Action, Crime, Drama            ","https://m.media-amazon.com/images/M/MV5BOTY4YjI2N2MtYmFlMC00ZjcyLTg3YjEtMDQyM2ZjYzQ5YWFkXkEyXkFqcGdeQXVyMTQxNzMzNDI@._V1_UX67_CR0,0,67,98_AL_.jpg","After training with his mentor, Batman begins his fight to free crime-ridden Gotham City from corruption."
Inglourious Basterds,8.3,A,2009,153 min,"Brad Pitt, Diane Kruger, Eli Roth, Mélanie Laurent","Adventure, Drama, War            ","https://m.media-amazon.com/images/M/MV5BOTJiNDEzOWYtMTVjOC00ZjlmLWE0NGMtZmE1OWVmZDQ2OWJhXkEyXkFqcGdeQXVyNTIzOTk5ODM@._V1_UX67_CR0,0,67,98_AL_.jpg","In Nazi-occupied France during World War II, a plan to assassinate Nazi leaders by a group of Jewish U.S. soldiers coincides with a theatre owner's vengeful plans for the same."
Eternal Sunshine of the Spotless Mind,8.3,UA,2004,108 min,"Jim Carrey, Kate Winslet, Tom Wilkinson, Gerry Robert Byrne","Drama, Romance, Sci-Fi            ","https://m.media-amazon.com/images/M/MV5BMTY4NzcwODg3Nl5BMl5BanBnXkFtZTcwNTEwOTMyMw@@._V1_UX67_CR0,0,67,98_AL_.jpg","When their relationship turns sour, a couple undergoes a medical procedure to have each other erased from their memories."
Le fabuleux destin d'Amélie Poulain,8.3,U,2001,122 min,"Audrey Tautou, Mathieu Kassovitz, Rufus, Lorella Cravotta","Comedy, Romance            ","https://m.media-amazon.com/images/M/MV5BNDg4NjM1YjMtYmNhZC00MjM0LWFiZmYtNGY1YjA3MzZmODc5XkEyXkFqcGdeQXVyNDk3NzU2MTQ@._V1_UX67_CR0,0,67,98_AL_.jpg","Amélie is an innocent and naive girl in Paris with her own sense of justice. She decides to help those around her and, along the way, discovers love."
Snatch,8.3,UA,2000,104 min,"Jason Statham, Brad Pitt, Stephen Graham, Vinnie Jones","Comedy, Crime            ","https://m.media-amazon.com/images/M/MV5BMTA2NDYxOGYtYjU1Mi00Y2QzLTgxMTQtMWI1MGI0ZGQ5MmU4XkEyXkFqcGdeQXVyNDk3NzU2MTQ@._V1_UY98_CR0,0,67,98_AL_.jpg","Unscrupulous boxing promoters, violent bookmakers, a Russian gangster, incompetent amateur robbers and supposedly Jewish jewelers fight to track down a priceless stolen diamond."
Requiem for a Dream,8.3,A,2000,102 min,"Ellen Burstyn, Jared Leto, Jennifer Connelly, Marlon Wayans",Drama            ,"https://m.media-amazon.com/images/M/MV5BOTdiNzJlOWUtNWMwNS00NmFlLWI0YTEtZmI3YjIzZWUyY2Y3XkEyXkFqcGdeQXVyNjU0OTQ0OTY@._V1_UX67_CR0,0,67,98_AL_.jpg",The drug-induced utopias of four Coney Island people are shattered when their addictions run deep.
L.A. Confidential,8.3,A,1997,138 min,"Kevin Spacey, Russell Crowe, Guy Pearce, Kim Basinger","Crime, Drama, Mystery            ","https://m.media-amazon.com/images/M/MV5BMDQ2YzEyZGItYWRhOS00MjBmLTkzMDUtMTdjYzkyMmQxZTJlXkEyXkFqcGdeQXVyNjU0OTQ0OTY@._V1_UX67_CR0,0,67,98_AL_.jpg","As corruption grows in 1950s Los Angeles, three policemen - one strait-laced, one brutal, and one sleazy - investigate a series of murders with their own brand of justice."
Good Will Hunting,8.3,U,1997,126 min,"Robin Williams, Matt Damon, Ben Affleck, Stellan Skarsgård","Drama, Romance            ","https://m.media-amazon.com/images/M/MV5BOTI0MzcxMTYtZDVkMy00NjY1LTgyMTYtZmUxN2M3NmQ2NWJhXkEyXkFqcGdeQXVyMTQxNzMzNDI@._V1_UX67_CR0,0,67,98_AL_.jpg","Will Hunting, a janitor at M.I.T., has a gift for mathematics, but needs help from a psychologist to find direction in his life."
Toy Story,8.3,U,1995,81 min,"Tom Hanks, Tim Allen, Don Rickles, Jim Varney","Animation, Adventure, Comedy            ","https://m.media-amazon.com/images/M/MV5BMDU2ZWJlMjktMTRhMy00ZTA5LWEzNDgtYmNmZTEwZTViZWJkXkEyXkFqcGdeQXVyNDQ2OTk4MzI@._V1_UX67_CR0,0,67,98_AL_.jpg",A cowboy doll is profoundly threatened and jealous when a new spaceman figure supplants him as top toy in a boy's room.
Heat,8.3,A,1995,170 min,"Al Pacino, Robert De Niro, Val Kilmer, Jon Voight","Action, Crime, Drama            ","https://m.media-amazon.com/images/M/MV5BNGMwNzUwNjYtZWM5NS00YzMyLWI4NjAtNjM0ZDBiMzE1YWExXkEyXkFqcGdeQXVyNDk3NzU2MTQ@._V1_UX67_CR0,0,67,98_AL_.jpg",A group of high-end professional thieves start to feel the heat from the LAPD when they unknowingly leave a clue at their latest heist.
Reservoir Dogs,8.3,15+,1992,99 min,"Harvey Keitel, Tim Roth, Michael Madsen, Chris Penn","Crime, Drama, Thriller            ","https://m.media-amazon.com/images/M/MV5BZmExNmEwYWItYmQzOS00YjA5LTk2MjktZjEyZDE1Y2QxNjA1XkEyXkFqcGdeQXVyMTQxNzMzNDI@._V1_UX67_CR0,0,67,98_AL_.jpg","When a simple jewelry heist goes horribly wrong, the surviving criminals begin to suspect that one of them is a police informant."
Indiana Jones and the Last Crusade,8.3,U,1989,127 min,"Harrison Ford, Sean Connery, Alison Doody, Denholm Elliott","Action, Adventure            ","https://m.media-amazon.com/images/M/MV5BMjNkMzc2N2QtNjVlNS00ZTk5LTg0MTgtODY2MDAwNTMwZjBjXkEyXkFqcGdeQXVyNDk3NzU2MTQ@._V1_UX67_CR0,0,67,98_AL_.jpg","In 1938, after his father Professor Henry Jones, Sr. goes missing while pursuing the Holy Grail, Professor Henry ""Indiana"" Jones, Jr. finds himself up against Adolf Hitler's Nazis again to stop them from obtaining its powers."
Die Hard,8.3,A,1988,132 min,"Bruce Willis, Alan Rickman, Bonnie Bedelia, Reginald VelJohnson","Action, Thriller            ","https://m.media-amazon.com/images/M/MV5BZjRlNDUxZjAtOGQ4OC00OTNlLTgxNmQtYTBmMDgwZmNmNjkxXkEyXkFqcGdeQXVyNzkwMjQ5NzM@._V1_UX67_CR0,0,67,98_AL_.jpg",An NYPD officer tries to save his wife and several others taken hostage by German terrorists during a Christmas party at the Nakatomi Plaza in Los Angeles.
Full Metal Jacket,8.3,UA,1987,116 min,"Matthew Modine, R. Lee Ermey, Vincent D'Onofrio, Adam Baldwin","Drama, War            ","https://m.media-amazon.com/images/M/MV5BNzkxODk0NjEtYjc4Mi00ZDI0LTgyYjEtYzc1NDkxY2YzYTgyXkEyXkFqcGdeQXVyNzkwMjQ5NzM@._V1_UX67_CR0,0,67,98_AL_.jpg",A pragmatic U.S. Marine observes the dehumanizing effects the Vietnam War has on his fellow recruits from their brutal boot camp training to the bloody street fighting in Hue.
Scarface,8.3,A,1983,170 min,"Al Pacino, Michelle Pfeiffer, Steven Bauer, Mary Elizabeth Mastrantonio","Crime, Drama            ","https://m.media-amazon.com/images/M/MV5BNjdjNGQ4NDEtNTEwYS00MTgxLTliYzQtYzE2ZDRiZjFhZmNlXkEyXkFqcGdeQXVyNjU0OTQ0OTY@._V1_UX67_CR0,0,67,98_AL_.jpg","In 1980 Miami, a determined Cuban immigrant takes over a drug cartel and succumbs to greed."
Star Wars: Episode VI - Return of the Jedi,8.3,U,1983,131 min,"Mark Hamill, Harrison Ford, Carrie Fisher, Billy Dee Williams","Action, Adventure, Fantasy            ","https://m.media-amazon.com/images/M/MV5BOWZlMjFiYzgtMTUzNC00Y2IzLTk1NTMtZmNhMTczNTk0ODk1XkEyXkFqcGdeQXVyNTAyODkwOQ@@._V1_UX67_CR0,0,67,98_AL_.jpg","After a daring mission to rescue Han Solo from Jabba the Hutt, the Rebels dispatch to Endor to destroy the second Death Star. Meanwhile, Luke struggles to help Darth Vader back from the dark side without falling into the Emperor's trap."
Taxi Driver,8.3,A,1976,114 min,"Robert De Niro, Jodie Foster, Cybill Shepherd, Albert Brooks","Crime, Drama            ","https://m.media-amazon.com/images/M/MV5BM2M1MmVhNDgtNmI0YS00ZDNmLTkyNjctNTJiYTQ2N2NmYzc2XkEyXkFqcGdeQXVyNzkwMjQ5NzM@._V1_UX67_CR0,0,67,98_AL_.jpg","A mentally unstable veteran works as a nighttime taxi driver in New York City, where the perceived decadence and sleaze fuels his urge for violent action."
Dersu Uzala,8.3,U,1975,142 min,"Maksim Munzuk, Yuriy Solomin, Mikhail Bychkov, Vladimir Khrulyov","Adventure, Biography, Drama            ","https://m.media-amazon.com/images/M/MV5BYWY0OWJlZTgtMWUzNy00MGJhLTk5YzQtNmY5MDEwOTIxNjMyXkEyXkFqcGdeQXVyNjc1NTYyMjg@._V1_UX67_CR0,0,67,98_AL_.jpg",The Russian army sends an explorer on an expedition to the snowy Siberian wilderness where he makes friends with a seasoned local hunter.
The Sting,8.3,U,1973,129 min,"Paul Newman, Robert Redford, Robert Shaw, Charles Durning","Comedy, Crime, Drama            ","https://m.media-amazon.com/images/M/MV5BNGU3NjQ4YTMtZGJjOS00YTQ3LThmNmItMTI5MDE2ODI3NzY3XkEyXkFqcGdeQXVyMjUzOTY1NTc@._V1_UX67_CR0,0,67,98_AL_.jpg",Two grifters team up to pull off the ultimate con.
A Clockwork Orange,8.3,A,1971,136 min,"Malcolm McDowell, Patrick Magee, Michael Bates, Warren Clarke","Crime, Sci-Fi            ","https://m.media-amazon.com/images/M/MV5BMTY3MjM1Mzc4N15BMl5BanBnXkFtZTgwODM0NzAxMDE@._V1_UX67_CR0,0,67,98_AL_.jpg","In the future, a sadistic gang leader is imprisoned and volunteers for a conduct-aversion experiment, but it doesn't go as planned."
2001: A Space Odyssey,8.3,U,1968,149 min,"Keir Dullea, Gary Lockwood, William Sylvester, Daniel Richter","Adventure, Sci-Fi            ","https://m.media-amazon.com/images/M/MV5BMmNlYzRiNDctZWNhMi00MzI4LThkZTctMTUzMmZkMmFmNThmXkEyXkFqcGdeQXVyNzkwMjQ5NzM@._V1_UX67_CR0,0,67,98_AL_.jpg","The Monoliths push humanity to reach for the stars; after their discovery in Africa generations ago, the mysterious objects lead mankind on an awesome journey to Jupiter, with the help of H.A.L. 9000: the world's greatest supercomputer."
Per qualche dollaro in più,8.3,U,1965,132 min,"Clint Eastwood, Lee Van Cleef, Gian Maria Volontè, Mara Krupp",Western            ,"https://m.media-amazon.com/images/M/MV5BNWM1NmYyM2ItMTFhNy00NDU0LThlYWUtYjQyYTJmOTY0ZmM0XkEyXkFqcGdeQXVyNjU0OTQ0OTY@._V1_UX67_CR0,0,67,98_AL_.jpg",Two bounty hunters with the same intentions team up to track down an escaped Mexican outlaw.
To Kill a Mockingbird,8.3,U,1962,129 min,"Gregory Peck, John Megna, Frank Overton, Rosemary Murphy","Crime, Drama            ","https://m.media-amazon.com/images/M/MV5BNmVmYzcwNzMtMWM1NS00MWIyLThlMDEtYzUwZDgzODE1NmE2XkEyXkFqcGdeQXVyNzkwMjQ5NzM@._V1_UX67_CR0,0,67,98_AL_.jpg","Atticus Finch, a widowed lawyer in Depression-era Alabama, defends a black man against an undeserved rape charge, and his children against prejudice."
Lawrence of Arabia,8.3,U,1962,228 min,"Peter O'Toole, Alec Guinness, Anthony Quinn, Jack Hawkins","Adventure, Biography, Drama            ","https://m.media-amazon.com/images/M/MV5BYWY5ZjhjNGYtZmI2Ny00ODM0LWFkNzgtZmI1YzA2N2MxMzA0XkEyXkFqcGdeQXVyNjUwNzk3NDc@._V1_UY98_CR0,0,67,98_AL_.jpg","The story of T.E. Lawrence, the English officer who successfully united and led the diverse, often warring, Arab tribes during World War I in order to fight the Turks."
Judgment at Nuremberg,8.3,A,1961,179 min,"Spencer Tracy, Burt Lancaster, Richard Widmark, Marlene Dietrich","Drama, War            ","https://m.media-amazon.com/images/M/MV5BNDc2ODQ5NTE2MV5BMl5BanBnXkFtZTcwODExMjUyNA@@._V1_UX67_CR0,0,67,98_AL_.jpg","In 1948, an American court in occupied Germany tries four Nazis judged for war crimes."
The Apartment,8.3,U,1960,125 min,"Jack Lemmon, Shirley MacLaine, Fred MacMurray, Ray Walston","Comedy, Drama, Romance            ","https://m.media-amazon.com/images/M/MV5BNzkwODFjNzItMmMwNi00MTU5LWE2MzktM2M4ZDczZGM1MmViXkEyXkFqcGdeQXVyNDY2MTk1ODk@._V1_UX67_CR0,0,67,98_AL_.jpg","A Manhattan insurance clerk tries to rise in his company by letting its executives use his apartment for trysts, but complications and a romance of his own ensue."
North by Northwest,8.3,U,1959,136 min,"Cary Grant, Eva Marie Saint, James Mason, Jessie Royce Landis","Adventure, Mystery, Thriller            ","https://m.media-amazon.com/images/M/MV5BZDA3NDExMTUtMDlhOC00MmQ5LWExZGUtYmI1NGVlZWI4OWNiXkEyXkFqcGdeQXVyNjc1NTYyMjg@._V1_UX67_CR0,0,67,98_AL_.jpg","A New York City advertising executive goes on the run after being mistaken for a government agent by a group of foreign spies, and falls for a woman whose loyalties he begins to doubt."
Vertigo,8.3,A,1958,128 min,"James Stewart, Kim Novak, Barbara Bel Geddes, Tom Helmore","Mystery, Romance, Thriller            ","https://m.media-amazon.com/images/M/MV5BYTE4ODEwZDUtNDFjOC00NjAxLWEzYTQtYTI1NGVmZmFlNjdiL2ltYWdlL2ltYWdlXkEyXkFqcGdeQXVyNjc1NTYyMjg@._V1_UX67_CR0,0,67,98_AL_.jpg","A former San Francisco police detective juggles wrestling with his personal demons and becoming obsessed with the hauntingly beautiful woman he has been hired to trail, who may be deeply disturbed."
Singin' in the Rain,8.3,G,1952,103 min,"Gene Kelly, Donald O'Connor, Debbie Reynolds, Jean Hagen","Comedy, Musical, Romance            ","https://m.media-amazon.com/images/M/MV5BZDRjNGViMjQtOThlMi00MTA3LThkYzQtNzJkYjBkMGE0YzE1XkEyXkFqcGdeQXVyNDYyMDk5MTU@._V1_UY98_CR0,0,67,98_AL_.jpg",A silent film star falls for a chorus girl just as he and his delusionally jealous screen partner are trying to make the difficult transition to talking pictures in 1920s Hollywood.
Ikiru,8.3,U,1952,143 min,"Takashi Shimura, Nobuo Kaneko, Shin'ichi Himori, Haruo Tanaka",Drama            ,"https://m.media-amazon.com/images/M/MV5BZTdkN2E5OTYtN2FiMi00YWUwLWEzMGMtZTMzNjY0NjgzYzFiXkEyXkFqcGdeQXVyMTI3ODAyMzE2._V1_UY98_CR1,0,67,98_AL_.jpg",A bureaucrat tries to find meaning in his life after he discovers he has terminal cancer.
All About Eve,8.3,NA,1950,138 min,"Bette Davis, Anne Baxter, George Sanders, Celeste Holm",Drama            ,"https://m.media-amazon.com/images/M/MV5BMTY2MTAzODI5NV5BMl5BanBnXkFtZTgwMjM4NzQ0MjE@._V1_UX67_CR0,0,67,98_AL_.jpg",A seemingly timid but secretly ruthless ingénue insinuates herself into the lives of an aging Broadway star and her circle of theater friends.
Ladri di biciclette,8.3,NA,1948,89 min,"Lamberto Maggiorani, Enzo Staiola, Lianella Carell, Elena Altieri",Drama            ,"https://m.media-amazon.com/images/M/MV5BNmI1ODdjODctMDlmMC00ZWViLWI5MzYtYzRhNDdjYmM3MzFjXkEyXkFqcGdeQXVyMTMxODk2OTU@._V1_UY98_CR0,0,67,98_AL_.jpg","In post-war Italy, a working-class man's bicycle is stolen, endangering his efforts to find work. He and his son set out to find it."
Double Indemnity,8.3,NA,1944,107 min,"Fred MacMurray, Barbara Stanwyck, Edward G. Robinson, Byron Barr","Crime, Drama, Film-Noir            ","https://m.media-amazon.com/images/M/MV5BOTdlNjgyZGUtOTczYi00MDdhLTljZmMtYTEwZmRiOWFkYjRhXkEyXkFqcGdeQXVyNDY2MTk1ODk@._V1_UX67_CR0,0,67,98_AL_.jpg","A Los Angeles insurance representative lets an alluring housewife seduce him into a scheme of insurance fraud and murder that arouses the suspicion of his colleague, an insurance investigator."
Citizen Kane,8.3,UA,1941,119 min,"Orson Welles, Joseph Cotten, Dorothy Comingore, Agnes Moorehead","Drama, Mystery            ","https://m.media-amazon.com/images/M/MV5BYjBiOTYxZWItMzdiZi00NjlkLWIzZTYtYmFhZjhiMTljOTdkXkEyXkFqcGdeQXVyNzkwMjQ5NzM@._V1_UX67_CR0,0,67,98_AL_.jpg","Following the death of publishing tycoon Charles Foster Kane, reporters scramble to uncover the meaning of his final utterance; 'Rosebud'."
M - Eine Stadt sucht einen Mörder,8.3,NA,1931,117 min,"Peter Lorre, Ellen Widmann, Inge Landgut, Otto Wernicke","Crime, Mystery, Thriller            ","https://m.media-amazon.com/images/M/MV5BODA4ODk3OTEzMF5BMl5BanBnXkFtZTgwMTQ2ODMwMzE@._V1_UX67_CR0,0,67,98_AL_.jpg","When the police in a German city are unable to catch a child-murderer, other criminals join in the manhunt."
Metropolis,8.3,NA,1927,153 min,"Brigitte Helm, Alfred Abel, Gustav Fröhlich, Rudolf Klein-Rogge","Drama, Sci-Fi            ","https://m.media-amazon.com/images/M/MV5BMTg5YWIyMWUtZDY5My00Zjc1LTljOTctYmI0MWRmY2M2NmRkXkEyXkFqcGdeQXVyMTMxODk2OTU@._V1_UX67_CR0,0,67,98_AL_.jpg","In a futuristic city sharply divided between the working class and the city planners, the son of the city's mastermind falls in love with a working-class prophet who predicts the coming of a savior to mediate their differences."
The Kid,8.3,NA,1921,68 min,"Charles Chaplin, Edna Purviance, Jackie Coogan, Carl Miller","Comedy, Drama, Family            ","https://m.media-amazon.com/images/M/MV5BZjhhMThhNDItNTY2MC00MmU1LTliNDEtNDdhZjdlNTY5ZDQ1XkEyXkFqcGdeQXVyNjc1NTYyMjg@._V1_UX67_CR0,0,67,98_AL_.jpg","The Tramp cares for an abandoned child, but events put that relationship in jeopardy."
Andhadhun,8.2,UA,2018,139 min,"Ayushmann Khurrana, Tabu, Radhika Apte, Anil Dhawan","Comedy, Crime, Music            ","https://m.media-amazon.com/images/M/MV5BZWZhMjhhZmYtOTIzOC00MGYzLWI1OGYtM2ZkN2IxNTI4ZWI3XkEyXkFqcGdeQXVyNDAzNDk0MTQ@._V1_UY98_CR0,0,67,98_AL_.jpg","A series of mysterious events change the life of a blind pianist, who must now report a crime that he should technically know nothing of."
Green Book,8.2,UA,2018,130 min,"Viggo Mortensen, Mahershala Ali, Linda Cardellini, Sebastian Maniscalco","Biography, Comedy, Drama            ","https://m.media-amazon.com/images/M/MV5BYzIzYmJlYTYtNGNiYy00N2EwLTk4ZjItMGYyZTJiOTVkM2RlXkEyXkFqcGdeQXVyODY1NDk1NjE@._V1_UX67_CR0,0,67,98_AL_.jpg",A working-class Italian-American bouncer becomes the driver of an African-American classical pianist on a tour of venues through the 1960s American South.
Klaus,8.2,7,2019,96 min,"Jason Schwartzman, J.K. Simmons, Rashida Jones, Will Sasso","Animation, Adventure, Comedy            ","https://m.media-amazon.com/images/M/MV5BMWYwOThjM2ItZGYxNy00NTQwLWFlZWEtM2MzM2Q5MmY3NDU5XkEyXkFqcGdeQXVyMTkxNjUyNQ@@._V1_UX67_CR0,0,67,98_AL_.jpg","A simple act of kindness always sparks another, even in a frozen, faraway place. When Smeerensburg's new postman, Jesper, befriends toymaker Klaus, their gifts melt an age-old feud and deliver a sleigh full of holiday traditions."
Drishyam,8.2,UA,2015,163 min,"Ajay Devgn, Shriya Saran, Tabu, Rajat Kapoor","Crime, Drama, Mystery            ","https://m.media-amazon.com/images/M/MV5BYmJhZmJlYTItZmZlNy00MGY0LTg0ZGMtNWFkYWU5NTA1YTNhXkEyXkFqcGdeQXVyODE5NzE3OTE@._V1_UY98_CR0,0,67,98_AL_.jpg","Desperate measures are taken by a man who tries to save his family from the dark side of the law, after they commit an unexpected crime."
Bajrangi Bhaijaan,8.2,UA,2015,163 min,"Salman Khan, Harshaali Malhotra, Nawazuddin Siddiqui, Kareena Kapoor","Action, Adventure, Comedy            ","https://m.media-amazon.com/images/M/MV5BMGE3Yjg3NzItNjlmOS00YjY2LThiMDctMzM0NDA2NmExYTg4XkEyXkFqcGdeQXVyMTQ3ODQ3NTcz._V1_UY98_CR0,0,67,98_AL_.jpg",An Indian man with a magnanimous heart takes a young mute Pakistani girl back to her homeland to reunite her with her family.
Haider,8.2,UA,2014,160 min,"Shahid Kapoor, Tabu, Shraddha Kapoor, Kay Kay Menon","Action, Crime, Drama            ","https://m.media-amazon.com/images/M/MV5BMjA1NTEwMDMxMF5BMl5BanBnXkFtZTgwODkzMzI0MjE@._V1_UY98_CR0,0,67,98_AL_.jpg","A young man returns to Kashmir after his father's disappearance to confront his uncle, whom he suspects of playing a role in his father's fate."
Queen,8.2,UA,2013,146 min,"Kangana Ranaut, Rajkummar Rao, Lisa Haydon, Jeffrey Ho","Adventure, Comedy, Drama            ","https://m.media-amazon.com/images/M/MV5BNWYyOWRlOWItZWM5MS00ZjJkLWI0MTUtYTE3NTI5MDAwYjgyXkEyXkFqcGdeQXVyODE5NzE3OTE@._V1_UY98_CR0,0,67,98_AL_.jpg",A Delhi girl from a traditional family sets out on a solo honeymoon after her marriage gets cancelled.
